{
  "beam": {
    "energy_keV": 23.1,
    "divergence_mrad": 20.0,
    "focal_spot": { "size_um": 0.02, "shape": "gaussian" }
  },
  "detector": {
    "pixels": [4432, 2368],
    "pixel_size_um": 4.6,
    "objective_magnification": 10.0,
    "efficiency": 0.85,
    "read_noise_e": 2.0,
    "include_poisson": true
  },
  "geometry": {
    "source_to_sample_mm": 75.0,
    "sample_to_detector_mm": 850.0
  },
  "sample": {
    "type": "voxel",
    "delta_path": "wires_delta.tif",
    "beta_path": "wires_beta.tif",
    "voxel_size_um": 0.5,
    "axis_order": "zyx"
  },
  "simulation": {
    "source_samples": 64,
    "n_photons_per_pixel": 5000,
    "seed": 7,
    "fft_padding": 2,
    "dtype": "complex64"
  },
  "output": {
    "path": "wires_projection.tif",
    "save_intermediate": false
  }
}
